{"schema_version":1,"stage":"transform_output","error_class":"output_schema_violation","error":"processed row fails its schema","violations":[{"instance_location":"/price","keyword_location":"https://schemas.cg-etl.internal/processed/market_snapshot.v1.json#/properties/price/type","message":"got null, want string"}],"origin":{"kind":"kafka","topic":"coingecko.raw","partition":0,"offset":815,"event_id":"0199d0a4-6c1e-7cc2-9a51-3f1f2b9d8e11","dataset":"market_snapshot","record_key":"bitcoin|2026-10-10T10:07:55.000Z"},"original_base64":"e30=","occurred_at":"2026-10-10T10:08:30.512Z"}
