{"schema_version":1,"stage":"export","error_class":"schema_violation","violations":[{"instance_location":"","keyword_location":"https://schemas.cg-etl.internal/pipeline/raw_event.v1.json#/required","message":"missing property 'payload'"}],"origin":{"kind":"postgres","batch_id":42,"event_id":"0199d0a4-6c1e-7cc2-9a51-3f1f2b9d8e11"},"original_base64":"","occurred_at":"2026-10-10T10:08:30.000Z"}
