{"schema_version":1,"stage":"transform_input","error_class":"schema_violation","violations":[{"instance_location":"/fetched_at","keyword_location":"https://schemas.cg-etl.internal/common/defs.v1.json#/$defs/utc_timestamp/pattern","message":"'2026-10-10T10:02:33+00:00' does not match pattern"}],"origin":{"kind":"kafka","topic":"coingecko.raw","partition":0,"offset":815,"event_id":"0199d0a4-6c1e-7cc2-9a51-3f1f2b9d8e11"},"original_base64":"eyJzY2hlbWFfdmVyc2lvbiI6MX0=","occurred_at":"2026-10-10T10:08:30.512Z"}
