{"schema_version":1,"stage":"export","error_class":"decode_error","violations":[{"instance_location":"","keyword_location":"","message":"payload is not valid JSON"}],"origin":{"kind":"postgres","batch_id":42,"seq":1077,"event_id":"0199d0a4-6c1e-7cc2-9a51-3f1f2b9d8e11"},"original_base64":"e30=","occurred_at":"2026-10-10T10:08:30.000Z"}
